{
  "$schema": "https://raw.githubusercontent.com/agile-north/rexo/schema-v1.0/policy.schema.json",
  "schemaVersion": "1.0",
  "name": "dotnet-library-policy",
  "description": "Policy template for .NET library and NuGet package projects. Provides the full dotnet lifecycle with NuGet-focused artifact commands.",
  "commands": {
    "ci": {
      "description": "Run the full CI pipeline: validate, test, analyze, and pack configured artifacts.",
      "options": {},
      "steps": [
        {
          "uses": "builtin:validate",
          "description": "Validate repo.json"
        },
        {
          "uses": "builtin:resolve-version",
          "description": "Resolve version"
        },
        {
          "uses": "builtin:test",
          "description": "Run tests"
        },
        {
          "uses": "builtin:analyze",
          "description": "Run analysis"
        },
        {
          "uses": "builtin:build-artifacts",
          "description": "Pack NuGet artifacts"
        }
      ]
    },
    "release": {
      "description": "Run CI then tag and optionally push configured NuGet artifacts.",
      "options": {
        "push": {
          "type": "bool",
          "default": false
        }
      },
      "steps": [
        {
          "uses": "builtin:validate",
          "description": "Validate repo.json"
        },
        {
          "uses": "builtin:resolve-version",
          "description": "Resolve version"
        },
        {
          "uses": "builtin:test",
          "description": "Run tests"
        },
        {
          "uses": "builtin:analyze",
          "description": "Run analysis"
        },
        {
          "uses": "builtin:build-artifacts",
          "description": "Pack NuGet artifacts"
        },
        {
          "uses": "builtin:tag-artifacts",
          "description": "Tag artifacts"
        },
        {
          "uses": "builtin:push-artifacts",
          "description": "Push NuGet packages",
          "when": "{{options.push}} == true",
          "with": {
            "confirm": "{{options.push}}"
          }
        }
      ]
    },
    "restore": {
      "description": "Restore NuGet packages.",
      "options": {},
      "steps": [
        { "run": "dotnet restore", "description": "Restore packages" }
      ]
    },
    "format": {
      "description": "Check code formatting with dotnet format.",
      "options": {
        "fix": {
          "type": "bool",
          "default": false
        }
      },
      "steps": [
        {
          "run": "dotnet format --verify-no-changes",
          "description": "Verify formatting",
          "when": "{{options.fix}} != true"
        },
        {
          "run": "dotnet format",
          "description": "Apply formatting",
          "when": "{{options.fix}} == true"
        }
      ]
    },
    "pack": {
      "description": "Pack NuGet packages.",
      "options": {
        "configuration": { "type": "string", "default": "Release" }
      },
      "steps": [
        { "uses": "builtin:resolve-version", "description": "Resolve version" },
        { "uses": "builtin:build-artifacts", "description": "Pack NuGet artifacts" }
      ]
    }
  },
  "aliases": {
    "r": "restore",
    "f": "format",
    "p": "pack"
  }
}
